{
  "trace_id": "trace-repo-check-finding-001",
  "source": "repo_check_gate",
  "task": "Add a new endpoint handler",
  "events": [
    {
      "id": "r1",
      "type": "user_message",
      "content": "Add a new endpoint handler for the billing service."
    },
    {
      "id": "r2",
      "type": "assistant_message",
      "content": "Added the handler in handlers.py.",
      "metadata": {"files_changed": ["handlers.py"]}
    },
    {
      "id": "r3",
      "type": "tool_result",
      "content": "Repository check finding LW-SECRET-001: hardcoded credential placeholder in handlers.py.",
      "metadata": {"finding_id": "LW-SECRET-001", "severity": "high", "path": "handlers.py"}
    },
    {
      "id": "r4",
      "type": "human_correction",
      "content": "Remove the hardcoded credential and load it from the environment instead.",
      "metadata": {"required_step": "no_inline_secrets"}
    },
    {
      "id": "r5",
      "type": "final_answer",
      "content": "Credential moved to an environment variable; the gate now passes."
    }
  ],
  "outcome": "corrected_by_human",
  "metadata": {"gate": "repository_check"}
}
